{
  "theme": "《易经》乾卦的六条龙：做事的六个阶段，每一步该做什么、别做什么",
  "title": "乾卦六条龙：职场每一步怎么走",
  "hook": "《易经》乾卦的六条龙，讲的就是做事的六个阶段，每个阶段该做的事都不一样。",
  "caption": "曾仕强讲《易经》，最实用的就是乾卦这六条龙。\n刚入行别抢风头，到了顶上要懂得收。\n对照看看你现在在哪一步。\n收藏起来，换阶段的时候再翻出来。",
  "hashtags": ["#易经", "#职场成长", "#涨知识", "#图文伙伴计划"],
  "style_id": "retro_comic",
  "source": "《易经的智慧》曾仕强 · 乾卦六龙",

  "character": {
    "id": "office_rookie",
    "name": "小周",
    "sheet": "二十五岁左右的卡通男青年，圆脸，黑色短发三七分，戴一副黑色细框圆眼镜，眼睛细长带笑，永远穿同一件浅灰色衬衫配深蓝色针织背心和卡其色长裤，左手腕戴一块棕色皮带手表，身形偏瘦",
    "signature": "黑框圆眼镜 + 深蓝色针织背心",
    "persona": "工作第三年的普通上班族，说话直接，爱把道理总结成做法"
  },

  "pages": [
    {
      "index": 1,
      "layout": "duo",
      "beats": [
        {
          "caption": "潜龙期：闷头练本事",
          "scene": "主角深夜独自坐在开放式办公区的工位前认真练习，周围一排排工位都空着，窗外是亮着灯的写字楼群，头顶只亮着一盏灯",
          "note": "本事不够时，把时间都花在基本功上"
        },
        {
          "caption": "潜龙期：别急着出头",
          "scene": "会议室里几位同事围着长桌抢着举手发言，主角坐在靠墙的后排安静听着、认真点头，百叶窗透进下午的阳光，墙角摆着一盆绿植",
          "note": "没实力先出头，只会把短板亮出来"
        }
      ]
    },
    {
      "index": 2,
      "layout": "duo",
      "beats": [
        {
          "caption": "见龙期：主动找贵人",
          "scene": "公司楼下咖啡店的露天座位旁，主角双手给一位头发花白的前辈递上一杯咖啡，微微弯腰请教，前辈笑着接过，背后是街道和高楼，上午阳光明亮",
          "note": "刚冒头最缺有人带，要主动去请教"
        },
        {
          "caption": "见龙期：别单打独斗",
          "scene": "主角和三位同事围在一张摊满图纸的大桌前一起讨论，主角指着图纸说话，其他人凑过来点头，身后是一排书架和落地窗外的城市",
          "note": "露了头角以后，靠团队才走得远"
        }
      ]
    },
    {
      "index": 3,
      "layout": "duo",
      "beats": [
        {
          "caption": "惕龙期：每晚复盘一次",
          "scene": "夜里主角坐在家中书桌前的台灯下，托着下巴认真回想今天做过的事，窗外是对面居民楼零星的灯光，桌角放着一杯热茶",
          "note": "白天埋头干，晚上想想哪里做错了"
        },
        {
          "caption": "惕龙期：别得意忘形",
          "scene": "热闹的庆功宴上同事们高举酒杯欢呼，主角站在人群边上只端着一杯清水微笑，神情清醒，身后是挂着暖色彩灯的餐厅和一张张圆桌",
          "note": "小有成绩时最容易出错，要时刻警惕"
        }
      ]
    },
    {
      "index": 4,
      "layout": "duo",
      "beats": [
        {
          "caption": "跃龙期：先小步试跳",
          "scene": "清晨的山间小溪边，主角先伸出一只脚轻踩溪中的一块石头试探稳不稳，身体重心还留在岸上，远处是连绵的青山和一座木桥，薄雾弥漫",
          "note": "想转型先拿小项目试水，别全押上"
        },
        {
          "caption": "跃龙期：给自己留退路",
          "scene": "室内攀岩馆里，主角站在高高的彩色攀岩墙前系好安全绳，回头确认绳结，旁边的教练握紧绳子另一端，头顶是场馆的钢架和顶灯",
          "note": "跳不过去也能退回来，才敢放手试"
        }
      ]
    },
    {
      "index": 5,
      "layout": "duo",
      "beats": [
        {
          "caption": "飞龙期：多用能人",
          "scene": "明亮的大办公室里，主角站在中央把几个文件夹分别交到围过来的几位同事手里，大家点头接过，落地窗外是晴朗的蓝天和高楼",
          "note": "到了高位，把事交给比你强的人办"
        },
        {
          "caption": "飞龙期：别独占功劳",
          "scene": "颁奖台上，主角把刚拿到的奖杯递给身边的团队伙伴，大家挤在一起笑着合影，台下坐满鼓掌的观众，舞台灯光明亮温暖",
          "note": "功劳分出去，下次才有人帮你"
        }
      ]
    },
    {
      "index": 6,
      "layout": "duo",
      "beats": [
        {
          "caption": "亢龙期：提前交棒",
          "scene": "傍晚的田径场上，主角跑进接力区，把接力棒稳稳交到一位年轻队员手里，对方接棒冲了出去，看台上的人群在欢呼",
          "note": "位置坐太久不放手，就成了亢龙"
        },
        {
          "caption": "亢龙期：见好就收",
          "scene": "山顶观景台上，主角拍完日落转身沿着台阶往下走，身后还有人挤着往更陡的崖边探身，远处是金色的云海和落日",
          "note": "到顶了还硬往上冲，就是亢龙有悔"
        }
      ]
    }
  ]
}
